{"$schema":"https://json-schema.org/draft/2020-12/schema","$id":"https://cinic0101.github.io/grepsignal/schema/coverage.schema.json","title":"GrepSignal public research coverage","type":"object","properties":{"schema_version":{"const":3},"cycle_id":{"type":"string","minLength":1},"coverage_status":{"enum":["not_recorded","partial","reviewed"]},"generated_at":{"type":"string","format":"date-time"},"sources":{"type":"array","minItems":1,"items":{"type":"object","properties":{"source_id":{"type":"string","minLength":1},"name":{"type":"string","minLength":1},"scope":{"type":"string","minLength":1},"intake_count":{"type":"integer","minimum":0},"reviewed_count":{"type":["integer","null"],"minimum":0}},"required":["source_id","name","scope","intake_count","reviewed_count"],"additionalProperties":false}},"research_targets_reviewed":{"type":"integer","minimum":0},"exact_sources_materialized":{"type":"integer","minimum":0},"note":{"type":"string","minLength":1}},"required":["schema_version","cycle_id","coverage_status","generated_at","sources","research_targets_reviewed","exact_sources_materialized","note"],"additionalProperties":false}