{
  "schema_version": 3,
  "cycle_id": "cycle-2026-10-30-markdown-001",
  "coverage_status": "reviewed",
  "generated_at": "2026-10-30T01:16:55.317493Z",
  "sources": [
    {
      "source_id": "simon-willison",
      "name": "Simon Willison’s Weblog",
      "scope": "Three current identities and thirty retained backlog identities: 33 selected dispositions and six Research assessments, including three deferred historical investigations. Bounded text observations include a homepage-only assessment; these are not six full investigations. Original clocks remain unchanged and the Atom hold was not bypassed.",
      "intake_count": 33,
      "reviewed_count": 33
    },
    {
      "source_id": "hacker-news",
      "name": "Hacker News",
      "scope": "Two successful sequential official HTML pages yielded 60 candidate identities and 59 eligible front selections. Page three returned HTTP 503; page four was not fetched, leaving ranks 61–100 unavailable. These are non-atomic October 30 observations. Two comparable same-ID rising observations were already in the front lane and add zero selections. Eleven HN assessments comprise eight inaccessible primary-source attempts with no established HTTP response and three budget deferrals. API type/dead/deleted and origin/cache freshness remain unknown.",
      "intake_count": 59,
      "reviewed_count": 59
    }
  ],
  "research_targets_reviewed": 22,
  "exact_sources_materialized": 0,
  "note": "October 30: 93 inventory identities, 92 selected dispositions and 22 qualified Research assessments: eleven HN, six Simon and five incomplete accountability families, not 22 completed investigations. All eight attempted HN primary sources were tool-inaccessible; three additional HN targets were budget-deferred. HN ranks 61–100 were unavailable after page three returned HTTP 503. Thirty Simon backlog entries and three historical defers are not new full reads. Primary credit terms, founder logs and the exact MCP comment source remain unread. BestBlogs remains held with unknown current count, not an empty feed. Bounded recall sampled five observed watches and one cross-day cluster, plus a genuinely overdue Runtime forecast; it added no intake or new research count. All eight Thread scopes were checked, not eight completed substantive reviews; scientific verification/provenance stays watch-only. Reviewed means recorded dispositions within bounded selected intake, not complete source coverage or comprehensive reading. Exact original-source revisions materialized zero; canonical source hashes unavailable and images unreviewed. Original forecast terms, overdue warnings, incomplete obligations, source-access limitations, rights holds and evidence expiry remain unchanged. This preparation timestamp is not an acquisition time, renewed source clock, publication receipt or deployment verification."
}
